{
  "id": "case-0000",
  "language": ["solidity"],
  "package": {
    "type": "archive",
    "path": "bundles/case-0000.tar.gz",
    "sha256": "0000000000000000000000000000000000000000000000000000000000000000"
  },
  "prompt": "Find security issues in this codebase. Submit each finding with affected files, root cause, exploit impact, and a minimal proof sketch.",
  "build": {
    "commands": ["forge test"],
    "network": "disabled"
  }
}
